47	22.706874	150.209.91.34	150.209.38.86	TCP	66	20006 → 61483 [ACK] Seq=1 Ack=4 Win=510 Len=0 TSval=1077684089 TSecr=256396521
48	22.706875	150.209.91.34	150.209.38.86	TCP	80	20006 → 61483 [PSH, ACK] Seq=1 Ack=4 Win=510 Len=14 TSval=1077684089 TSecr=256396521
51	22.710985	150.209.91.34	150.209.38.86	TCP	71	20006 → 61483 [PSH, ACK] Seq=15 Ack=18 Win=510 Len=5 TSval=1077684093 TSecr=256396534
54	22.715538	150.209.91.34	150.209.38.86	TCP	1090	20006 → 61483 [PSH, ACK] Seq=20 Ack=36 Win=510 Len=1024 TSval=1077684097 TSecr=256396538
55	22.715540	150.209.91.34	150.209.38.86	TCP	1304	20006 → 61483 [ACK] Seq=1044 Ack=36 Win=510 Len=1238 TSval=1077684097 TSecr=256396538
56	22.715541	150.209.91.34	150.209.38.86	TCP	1304	20006 → 61483 [ACK] Seq=2282 Ack=36 Win=510 Len=1238 TSval=1077684097 TSecr=256396538
57	22.715543	150.209.91.34	150.209.38.86	TCP	1304	20006 → 61483 [ACK] Seq=3520 Ack=36 Win=510 Len=1238 TSval=1077684097 TSecr=256396538
58	22.715544	150.209.91.34	150.209.38.86	TCP	1304	20006 → 61483 [PSH, ACK] Seq=4758 Ack=36 Win=510 Len=1238 TSval=1077684097 TSecr=256396538
59	22.715545	150.209.91.34	150.209.38.86	TCP	1304	20006 → 61483 [ACK] Seq=5996 Ack=36 Win=510 Len=1238 TSval=1077684097 TSecr=256396538
60	22.715547	150.209.91.34	150.209.38.86	TCP	1304	20006 → 61483 [ACK] Seq=7234 Ack=36 Win=510 Len=1238 TSval=1077684097 TSecr=256396538
61	22.715548	150.209.91.34	150.209.38.86	TCP	1304	20006 → 61483 [PSH, ACK] Seq=8472 Ack=36 Win=510 Len=1238 TSval=1077684097 TSecr=256396538
62	22.715549	150.209.91.34	150.209.38.86	TCP	1304	20006 → 61483 [ACK] Seq=9710 Ack=36 Win=510 Len=1238 TSval=1077684097 TSecr=256396538
63	22.715550	150.209.91.34	150.209.38.86	TCP	1304	20006 → 61483 [PSH, ACK] Seq=10948 Ack=36 Win=510 Len=1238 TSval=1077684097 TSecr=256396538
66	22.719821	150.209.91.34	150.209.38.86	TCP	1304	20006 → 61483 [ACK] Seq=12186 Ack=36 Win=510 Len=1238 TSval=1077684101 TSecr=256396542
67	22.719823	150.209.91.34	150.209.38.86	TCP	1304	20006 → 61483 [ACK] Seq=13424 Ack=36 Win=510 Len=1238 TSval=1077684101 TSecr=256396542
68	22.719824	150.209.91.34	150.209.38.86	TCP	303	20006 → 61483 [PSH, ACK] Seq=14662 Ack=36 Win=510 Len=237 TSval=1077684101 TSecr=256396542
72	22.765768	150.209.91.34	150.209.38.86	TCP	66	20006 → 61483 [ACK] Seq=14899 Ack=69 Win=510 Len=0 TSval=1077684148 TSecr=256396546