43	6.873799	150.209.91.34	150.209.38.86	TCP	66	20006 → 61483 [ACK] Seq=1 Ack=4 Win=510 Len=0 TSval=1077776493 TSecr=256488928
44	6.873801	150.209.91.34	150.209.38.86	TCP	80	20006 → 61483 [PSH, ACK] Seq=1 Ack=4 Win=510 Len=14 TSval=1077776494 TSecr=256488928
47	6.877424	150.209.91.34	150.209.38.86	TCP	71	20006 → 61483 [PSH, ACK] Seq=15 Ack=18 Win=510 Len=5 TSval=1077776497 TSecr=256488940
50	6.881958	150.209.91.34	150.209.38.86	TCP	1090	20006 → 61483 [PSH, ACK] Seq=20 Ack=36 Win=510 Len=1024 TSval=1077776502 TSecr=256488944
52	6.883284	150.209.91.34	150.209.38.86	TCP	1304	20006 → 61483 [ACK] Seq=1044 Ack=36 Win=510 Len=1238 TSval=1077776502 TSecr=256488944
53	6.883285	150.209.91.34	150.209.38.86	TCP	1304	20006 → 61483 [ACK] Seq=2282 Ack=36 Win=510 Len=1238 TSval=1077776502 TSecr=256488944
54	6.883286	150.209.91.34	150.209.38.86	TCP	1304	20006 → 61483 [ACK] Seq=3520 Ack=36 Win=510 Len=1238 TSval=1077776502 TSecr=256488944
55	6.883288	150.209.91.34	150.209.38.86	TCP	1304	20006 → 61483 [PSH, ACK] Seq=4758 Ack=36 Win=510 Len=1238 TSval=1077776502 TSecr=256488944
56	6.883289	150.209.91.34	150.209.38.86	TCP	1304	20006 → 61483 [ACK] Seq=5996 Ack=36 Win=510 Len=1238 TSval=1077776502 TSecr=256488944
57	6.883290	150.209.91.34	150.209.38.86	TCP	1304	20006 → 61483 [PSH, ACK] Seq=7234 Ack=36 Win=510 Len=1238 TSval=1077776502 TSecr=256488944
58	6.883291	150.209.91.34	150.209.38.86	TCP	1304	20006 → 61483 [ACK] Seq=8472 Ack=36 Win=510 Len=1238 TSval=1077776502 TSecr=256488944
59	6.883292	150.209.91.34	150.209.38.86	TCP	1304	20006 → 61483 [ACK] Seq=9710 Ack=36 Win=510 Len=1238 TSval=1077776502 TSecr=256488944
60	6.883293	150.209.91.34	150.209.38.86	TCP	1304	20006 → 61483 [PSH, ACK] Seq=10948 Ack=36 Win=510 Len=1238 TSval=1077776502 TSecr=256488944
63	6.884692	150.209.91.34	150.209.38.86	TCP	1304	20006 → 61483 [ACK] Seq=12186 Ack=36 Win=510 Len=1238 TSval=1077776505 TSecr=256488948
64	6.884694	150.209.91.34	150.209.38.86	TCP	1304	20006 → 61483 [PSH, ACK] Seq=13424 Ack=36 Win=510 Len=1238 TSval=1077776505 TSecr=256488948
67	6.887170	150.209.91.34	150.209.38.86	TCP	1304	20006 → 61483 [ACK] Seq=14662 Ack=36 Win=510 Len=1238 TSval=1077776507 TSecr=256488950
68	6.887172	150.209.91.34	150.209.38.86	TCP	1304	20006 → 61483 [ACK] Seq=15900 Ack=36 Win=510 Len=1238 TSval=1077776507 TSecr=256488950
69	6.887174	150.209.91.34	150.209.38.86	TCP	1304	20006 → 61483 [ACK] Seq=17138 Ack=36 Win=510 Len=1238 TSval=1077776507 TSecr=256488950
72	6.888487	150.209.91.34	150.209.38.86	TCP	1304	20006 → 61483 [ACK] Seq=18376 Ack=36 Win=510 Len=1238 TSval=1077776507 TSecr=256488950
73	6.888489	150.209.91.34	150.209.38.86	TCP	1304	20006 → 61483 [ACK] Seq=19614 Ack=36 Win=510 Len=1238 TSval=1077776507 TSecr=256488950
74	6.888491	150.209.91.34	150.209.38.86	TCP	1304	20006 → 61483 [ACK] Seq=20852 Ack=36 Win=510 Len=1238 TSval=1077776507 TSecr=256488950
75	6.888492	150.209.91.34	150.209.38.86	TCP	1304	20006 → 61483 [ACK] Seq=22090 Ack=36 Win=510 Len=1238 TSval=1077776507 TSecr=256488950
76	6.888494	150.209.91.34	150.209.38.86	TCP	1304	20006 → 61483 [PSH, ACK] Seq=23328 Ack=36 Win=510 Len=1238 TSval=1077776507 TSecr=256488950
77	6.888495	150.209.91.34	150.209.38.86	TCP	1304	20006 → 61483 [ACK] Seq=24566 Ack=36 Win=510 Len=1238 TSval=1077776507 TSecr=256488950
78	6.888497	150.209.91.34	150.209.38.86	TCP	1304	20006 → 61483 [ACK] Seq=25804 Ack=36 Win=510 Len=1238 TSval=1077776507 TSecr=256488950
79	6.888498	150.209.91.34	150.209.38.86	TCP	1304	20006 → 61483 [ACK] Seq=27042 Ack=36 Win=510 Len=1238 TSval=1077776507 TSecr=256488950
80	6.888499	150.209.91.34	150.209.38.86	TCP	1304	20006 → 61483 [ACK] Seq=28280 Ack=36 Win=510 Len=1238 TSval=1077776507 TSecr=256488950
81	6.888500	150.209.91.34	150.209.38.86	TCP	327	20006 → 61483 [PSH, ACK] Seq=29518 Ack=36 Win=510 Len=261 TSval=1077776507 TSecr=256488950
85	6.934698	150.209.91.34	150.209.38.86	TCP	66	20006 → 61483 [ACK] Seq=29779 Ack=69 Win=510 Len=0 TSval=1077776554 TSecr=256488955