19	5.540638	150.209.91.34	150.209.38.86	TCP	66	20006 → 61483 [ACK] Seq=1 Ack=4 Win=510 Len=0 TSval=1077832923 TSecr=256545360
20	5.540640	150.209.91.34	150.209.38.86	TCP	80	20006 → 61483 [PSH, ACK] Seq=1 Ack=4 Win=510 Len=14 TSval=1077832923 TSecr=256545360
23	5.545636	150.209.91.34	150.209.38.86	TCP	71	20006 → 61483 [PSH, ACK] Seq=15 Ack=18 Win=510 Len=5 TSval=1077832928 TSecr=256545372
26	5.550353	150.209.91.34	150.209.38.86	TCP	1090	20006 → 61483 [PSH, ACK] Seq=20 Ack=36 Win=510 Len=1024 TSval=1077832933 TSecr=256545377
27	5.550354	150.209.91.34	150.209.38.86	TCP	1304	20006 → 61483 [ACK] Seq=1044 Ack=36 Win=510 Len=1238 TSval=1077832933 TSecr=256545377
29	5.552343	150.209.91.34	150.209.38.86	TCP	1304	20006 → 61483 [ACK] Seq=2282 Ack=36 Win=510 Len=1238 TSval=1077832933 TSecr=256545377
30	5.552344	150.209.91.34	150.209.38.86	TCP	1304	20006 → 61483 [ACK] Seq=3520 Ack=36 Win=510 Len=1238 TSval=1077832933 TSecr=256545377
31	5.552346	150.209.91.34	150.209.38.86	TCP	1304	20006 → 61483 [PSH, ACK] Seq=4758 Ack=36 Win=510 Len=1238 TSval=1077832933 TSecr=256545377
32	5.552347	150.209.91.34	150.209.38.86	TCP	1304	20006 → 61483 [ACK] Seq=5996 Ack=36 Win=510 Len=1238 TSval=1077832933 TSecr=256545377
33	5.552348	150.209.91.34	150.209.38.86	TCP	1304	20006 → 61483 [ACK] Seq=7234 Ack=36 Win=510 Len=1238 TSval=1077832933 TSecr=256545377
34	5.552350	150.209.91.34	150.209.38.86	TCP	1304	20006 → 61483 [ACK] Seq=8472 Ack=36 Win=510 Len=1238 TSval=1077832933 TSecr=256545377
35	5.552352	150.209.91.34	150.209.38.86	TCP	1304	20006 → 61483 [PSH, ACK] Seq=9710 Ack=36 Win=510 Len=1238 TSval=1077832933 TSecr=256545377
36	5.552353	150.209.91.34	150.209.38.86	TCP	1304	20006 → 61483 [ACK] Seq=10948 Ack=36 Win=510 Len=1238 TSval=1077832933 TSecr=256545377
39	5.553927	150.209.91.34	150.209.38.86	TCP	1304	20006 → 61483 [ACK] Seq=12186 Ack=36 Win=510 Len=1238 TSval=1077832938 TSecr=256545381
40	5.553928	150.209.91.34	150.209.38.86	TCP	1304	20006 → 61483 [ACK] Seq=13424 Ack=36 Win=510 Len=1238 TSval=1077832938 TSecr=256545381
41	5.553929	150.209.91.34	150.209.38.86	TCP	1304	20006 → 61483 [ACK] Seq=14662 Ack=36 Win=510 Len=1238 TSval=1077832938 TSecr=256545381
42	5.553930	150.209.91.34	150.209.38.86	TCP	1304	20006 → 61483 [PSH, ACK] Seq=15900 Ack=36 Win=510 Len=1238 TSval=1077832938 TSecr=256545381
45	5.558636	150.209.91.34	150.209.38.86	TCP	1304	20006 → 61483 [ACK] Seq=17138 Ack=36 Win=510 Len=1238 TSval=1077832940 TSecr=256545383
46	5.558637	150.209.91.34	150.209.38.86	TCP	1304	20006 → 61483 [ACK] Seq=18376 Ack=36 Win=510 Len=1238 TSval=1077832940 TSecr=256545383
47	5.558638	150.209.91.34	150.209.38.86	TCP	1304	20006 → 61483 [ACK] Seq=19614 Ack=36 Win=510 Len=1238 TSval=1077832940 TSecr=256545383
48	5.558639	150.209.91.34	150.209.38.86	TCP	1304	20006 → 61483 [ACK] Seq=20852 Ack=36 Win=510 Len=1238 TSval=1077832940 TSecr=256545383
49	5.558640	150.209.91.34	150.209.38.86	TCP	1304	20006 → 61483 [ACK] Seq=22090 Ack=36 Win=510 Len=1238 TSval=1077832940 TSecr=256545383
50	5.558641	150.209.91.34	150.209.38.86	TCP	1304	20006 → 61483 [PSH, ACK] Seq=23328 Ack=36 Win=510 Len=1238 TSval=1077832940 TSecr=256545383
51	5.558641	150.209.91.34	150.209.38.86	TCP	1304	20006 → 61483 [ACK] Seq=24566 Ack=36 Win=510 Len=1238 TSval=1077832940 TSecr=256545383
52	5.558642	150.209.91.34	150.209.38.86	TCP	1304	20006 → 61483 [ACK] Seq=25804 Ack=36 Win=510 Len=1238 TSval=1077832940 TSecr=256545383
53	5.558643	150.209.91.34	150.209.38.86	TCP	1304	20006 → 61483 [ACK] Seq=27042 Ack=36 Win=510 Len=1238 TSval=1077832940 TSecr=256545383
54	5.558644	150.209.91.34	150.209.38.86	TCP	1304	20006 → 61483 [ACK] Seq=28280 Ack=36 Win=510 Len=1238 TSval=1077832940 TSecr=256545383
55	5.558645	150.209.91.34	150.209.38.86	TCP	1304	20006 → 61483 [ACK] Seq=29518 Ack=36 Win=510 Len=1238 TSval=1077832940 TSecr=256545383
56	5.558646	150.209.91.34	150.209.38.86	TCP	1304	20006 → 61483 [PSH, ACK] Seq=30756 Ack=36 Win=510 Len=1238 TSval=1077832940 TSecr=256545383
57	5.558647	150.209.91.34	150.209.38.86	TCP	1304	20006 → 61483 [ACK] Seq=31994 Ack=36 Win=510 Len=1238 TSval=1077832940 TSecr=256545383
58	5.558648	150.209.91.34	150.209.38.86	TCP	1304	20006 → 61483 [ACK] Seq=33232 Ack=36 Win=510 Len=1238 TSval=1077832940 TSecr=256545383
59	5.558648	150.209.91.34	150.209.38.86	TCP	1304	20006 → 61483 [ACK] Seq=34470 Ack=36 Win=510 Len=1238 TSval=1077832940 TSecr=256545383
60	5.558649	150.209.91.34	150.209.38.86	TCP	1304	20006 → 61483 [PSH, ACK] Seq=35708 Ack=36 Win=510 Len=1238 TSval=1077832940 TSecr=256545383
61	5.558650	150.209.91.34	150.209.38.86	TCP	1304	20006 → 61483 [ACK] Seq=36946 Ack=36 Win=510 Len=1238 TSval=1077832941 TSecr=256545385
62	5.558651	150.209.91.34	150.209.38.86	TCP	1304	20006 → 61483 [ACK] Seq=38184 Ack=36 Win=510 Len=1238 TSval=1077832941 TSecr=256545385
63	5.558652	150.209.91.34	150.209.38.86	TCP	1304	20006 → 61483 [ACK] Seq=39422 Ack=36 Win=510 Len=1238 TSval=1077832941 TSecr=256545385
64	5.558653	150.209.91.34	150.209.38.86	TCP	1304	20006 → 61483 [ACK] Seq=40660 Ack=36 Win=510 Len=1238 TSval=1077832941 TSecr=256545385
65	5.558654	150.209.91.34	150.209.38.86	TCP	1304	20006 → 61483 [ACK] Seq=41898 Ack=36 Win=510 Len=1238 TSval=1077832941 TSecr=256545385
66	5.558655	150.209.91.34	150.209.38.86	TCP	1304	20006 → 61483 [ACK] Seq=43136 Ack=36 Win=510 Len=1238 TSval=1077832941 TSecr=256545385
67	5.558655	150.209.91.34	150.209.38.86	TCP	351	20006 → 61483 [PSH, ACK] Seq=44374 Ack=36 Win=510 Len=285 TSval=1077832941 TSecr=256545385
77	5.604730	150.209.91.34	150.209.38.86	TCP	66	20006 → 61483 [ACK] Seq=44659 Ack=69 Win=510 Len=0 TSval=1077832989 TSecr=256545390