47	12.271088	150.209.91.34	150.209.38.86	TCP	66	20006 → 61483 [ACK] Seq=1 Ack=4 Win=510 Len=0 TSval=1077885286 TSecr=256597723
48	12.271090	150.209.91.34	150.209.38.86	TCP	80	20006 → 61483 [PSH, ACK] Seq=1 Ack=4 Win=510 Len=14 TSval=1077885286 TSecr=256597723
51	12.275164	150.209.91.34	150.209.38.86	TCP	71	20006 → 61483 [PSH, ACK] Seq=15 Ack=18 Win=510 Len=5 TSval=1077885290 TSecr=256597735
54	12.278717	150.209.91.34	150.209.38.86	TCP	1090	20006 → 61483 [PSH, ACK] Seq=20 Ack=36 Win=510 Len=1024 TSval=1077885294 TSecr=256597739
55	12.278719	150.209.91.34	150.209.38.86	TCP	1304	20006 → 61483 [ACK] Seq=1044 Ack=36 Win=510 Len=1238 TSval=1077885294 TSecr=256597739
57	12.280094	150.209.91.34	150.209.38.86	TCP	1304	20006 → 61483 [ACK] Seq=2282 Ack=36 Win=510 Len=1238 TSval=1077885294 TSecr=256597739
58	12.280097	150.209.91.34	150.209.38.86	TCP	1304	20006 → 61483 [ACK] Seq=3520 Ack=36 Win=510 Len=1238 TSval=1077885294 TSecr=256597739
59	12.280098	150.209.91.34	150.209.38.86	TCP	1304	20006 → 61483 [PSH, ACK] Seq=4758 Ack=36 Win=510 Len=1238 TSval=1077885294 TSecr=256597739
60	12.280103	150.209.91.34	150.209.38.86	TCP	1304	20006 → 61483 [ACK] Seq=5996 Ack=36 Win=510 Len=1238 TSval=1077885294 TSecr=256597739
61	12.280106	150.209.91.34	150.209.38.86	TCP	1304	20006 → 61483 [ACK] Seq=7234 Ack=36 Win=510 Len=1238 TSval=1077885294 TSecr=256597739
62	12.280107	150.209.91.34	150.209.38.86	TCP	1304	20006 → 61483 [ACK] Seq=8472 Ack=36 Win=510 Len=1238 TSval=1077885294 TSecr=256597739
63	12.280109	150.209.91.34	150.209.38.86	TCP	1304	20006 → 61483 [ACK] Seq=9710 Ack=36 Win=510 Len=1238 TSval=1077885294 TSecr=256597739
64	12.280111	150.209.91.34	150.209.38.86	TCP	1304	20006 → 61483 [PSH, ACK] Seq=10948 Ack=36 Win=510 Len=1238 TSval=1077885294 TSecr=256597739
67	12.282084	150.209.91.34	150.209.38.86	TCP	1304	20006 → 61483 [ACK] Seq=12186 Ack=36 Win=510 Len=1238 TSval=1077885297 TSecr=256597742
68	12.282086	150.209.91.34	150.209.38.86	TCP	1304	20006 → 61483 [ACK] Seq=13424 Ack=36 Win=510 Len=1238 TSval=1077885297 TSecr=256597742
69	12.282088	150.209.91.34	150.209.38.86	TCP	1304	20006 → 61483 [ACK] Seq=14662 Ack=36 Win=510 Len=1238 TSval=1077885297 TSecr=256597742
70	12.282090	150.209.91.34	150.209.38.86	TCP	1304	20006 → 61483 [PSH, ACK] Seq=15900 Ack=36 Win=510 Len=1238 TSval=1077885297 TSecr=256597742
73	12.284507	150.209.91.34	150.209.38.86	TCP	1304	20006 → 61483 [ACK] Seq=17138 Ack=36 Win=510 Len=1238 TSval=1077885299 TSecr=256597744
74	12.284509	150.209.91.34	150.209.38.86	TCP	1304	20006 → 61483 [ACK] Seq=18376 Ack=36 Win=510 Len=1238 TSval=1077885299 TSecr=256597744
75	12.284510	150.209.91.34	150.209.38.86	TCP	1304	20006 → 61483 [ACK] Seq=19614 Ack=36 Win=510 Len=1238 TSval=1077885299 TSecr=256597744
76	12.284511	150.209.91.34	150.209.38.86	TCP	1304	20006 → 61483 [ACK] Seq=20852 Ack=36 Win=510 Len=1238 TSval=1077885299 TSecr=256597744
77	12.284513	150.209.91.34	150.209.38.86	TCP	1304	20006 → 61483 [ACK] Seq=22090 Ack=36 Win=510 Len=1238 TSval=1077885299 TSecr=256597744
78	12.284514	150.209.91.34	150.209.38.86	TCP	1304	20006 → 61483 [PSH, ACK] Seq=23328 Ack=36 Win=510 Len=1238 TSval=1077885299 TSecr=256597744
79	12.284515	150.209.91.34	150.209.38.86	TCP	1304	20006 → 61483 [ACK] Seq=24566 Ack=36 Win=510 Len=1238 TSval=1077885299 TSecr=256597744
80	12.284516	150.209.91.34	150.209.38.86	TCP	1304	20006 → 61483 [ACK] Seq=25804 Ack=36 Win=510 Len=1238 TSval=1077885299 TSecr=256597744
81	12.284518	150.209.91.34	150.209.38.86	TCP	1304	20006 → 61483 [ACK] Seq=27042 Ack=36 Win=510 Len=1238 TSval=1077885299 TSecr=256597744
82	12.284520	150.209.91.34	150.209.38.86	TCP	1304	20006 → 61483 [ACK] Seq=28280 Ack=36 Win=510 Len=1238 TSval=1077885299 TSecr=256597744
83	12.284521	150.209.91.34	150.209.38.86	TCP	1304	20006 → 61483 [ACK] Seq=29518 Ack=36 Win=510 Len=1238 TSval=1077885299 TSecr=256597744
84	12.284523	150.209.91.34	150.209.38.86	TCP	1304	20006 → 61483 [PSH, ACK] Seq=30756 Ack=36 Win=510 Len=1238 TSval=1077885299 TSecr=256597744
85	12.284524	150.209.91.34	150.209.38.86	TCP	1304	20006 → 61483 [ACK] Seq=31994 Ack=36 Win=510 Len=1238 TSval=1077885299 TSecr=256597744
86	12.284525	150.209.91.34	150.209.38.86	TCP	1304	20006 → 61483 [ACK] Seq=33232 Ack=36 Win=510 Len=1238 TSval=1077885299 TSecr=256597744
87	12.284526	150.209.91.34	150.209.38.86	TCP	1304	20006 → 61483 [ACK] Seq=34470 Ack=36 Win=510 Len=1238 TSval=1077885299 TSecr=256597744
88	12.284527	150.209.91.34	150.209.38.86	TCP	1304	20006 → 61483 [PSH, ACK] Seq=35708 Ack=36 Win=510 Len=1238 TSval=1077885299 TSecr=256597744
92	12.287883	150.209.91.34	150.209.38.86	TCP	1304	20006 → 61483 [ACK] Seq=36946 Ack=36 Win=510 Len=1238 TSval=1077885302 TSecr=256597746
93	12.287885	150.209.91.34	150.209.38.86	TCP	1304	20006 → 61483 [ACK] Seq=38184 Ack=36 Win=510 Len=1238 TSval=1077885302 TSecr=256597746
94	12.287886	150.209.91.34	150.209.38.86	TCP	1304	20006 → 61483 [ACK] Seq=39422 Ack=36 Win=510 Len=1238 TSval=1077885302 TSecr=256597746
95	12.287887	150.209.91.34	150.209.38.86	TCP	1304	20006 → 61483 [ACK] Seq=40660 Ack=36 Win=510 Len=1238 TSval=1077885302 TSecr=256597746
96	12.287888	150.209.91.34	150.209.38.86	TCP	1304	20006 → 61483 [ACK] Seq=41898 Ack=36 Win=510 Len=1238 TSval=1077885302 TSecr=256597746
97	12.287890	150.209.91.34	150.209.38.86	TCP	1304	20006 → 61483 [ACK] Seq=43136 Ack=36 Win=510 Len=1238 TSval=1077885302 TSecr=256597746
98	12.287896	150.209.91.34	150.209.38.86	TCP	1304	20006 → 61483 [PSH, ACK] Seq=44374 Ack=36 Win=510 Len=1238 TSval=1077885302 TSecr=256597746
101	12.289250	150.209.91.34	150.209.38.86	TCP	1304	20006 → 61483 [ACK] Seq=45612 Ack=36 Win=510 Len=1238 TSval=1077885303 TSecr=256597748
102	12.289252	150.209.91.34	150.209.38.86	TCP	1304	20006 → 61483 [ACK] Seq=46850 Ack=36 Win=510 Len=1238 TSval=1077885303 TSecr=256597748
103	12.289253	150.209.91.34	150.209.38.86	TCP	1304	20006 → 61483 [ACK] Seq=48088 Ack=36 Win=510 Len=1238 TSval=1077885303 TSecr=256597748
104	12.289254	150.209.91.34	150.209.38.86	TCP	1304	20006 → 61483 [ACK] Seq=49326 Ack=36 Win=510 Len=1238 TSval=1077885303 TSecr=256597748
105	12.289255	150.209.91.34	150.209.38.86	TCP	1304	20006 → 61483 [ACK] Seq=50564 Ack=36 Win=510 Len=1238 TSval=1077885303 TSecr=256597748
106	12.289256	150.209.91.34	150.209.38.86	TCP	1304	20006 → 61483 [ACK] Seq=51802 Ack=36 Win=510 Len=1238 TSval=1077885303 TSecr=256597748
107	12.289257	150.209.91.34	150.209.38.86	TCP	1304	20006 → 61483 [ACK] Seq=53040 Ack=36 Win=510 Len=1238 TSval=1077885303 TSecr=256597748
108	12.289258	150.209.91.34	150.209.38.86	TCP	1304	20006 → 61483 [PSH, ACK] Seq=54278 Ack=36 Win=510 Len=1238 TSval=1077885303 TSecr=256597748
109	12.289259	150.209.91.34	150.209.38.86	TCP	1304	20006 → 61483 [ACK] Seq=55516 Ack=36 Win=510 Len=1238 TSval=1077885303 TSecr=256597748
110	12.289260	150.209.91.34	150.209.38.86	TCP	1304	20006 → 61483 [ACK] Seq=56754 Ack=36 Win=510 Len=1238 TSval=1077885303 TSecr=256597748
111	12.289262	150.209.91.34	150.209.38.86	TCP	1304	20006 → 61483 [ACK] Seq=57992 Ack=36 Win=510 Len=1238 TSval=1077885303 TSecr=256597748
112	12.289262	150.209.91.34	150.209.38.86	TCP	375	20006 → 61483 [PSH, ACK] Seq=59230 Ack=36 Win=510 Len=309 TSval=1077885303 TSecr=256597748
116	12.336377	150.209.91.34	150.209.38.86	TCP	66	20006 → 61483 [ACK] Seq=59539 Ack=69 Win=510 Len=0 TSval=1077885351 TSecr=256597754